{"policyKey":"policy-003-v2","targetId":"target-003","version":2,"manifestHash":"0xabc123","creator":"0x3333333333333333333333333333333333333333","createdAt":"2026-08-01T00:00:00Z","activationNotBefore":"2026-08-02T00:00:00Z","activatedAt":"2026-08-02T00:00:00Z","sealed":true,"active":true,"superseded":false,"ruleCount":2,"resourceCount":2,"effectCount":3,"humanOverrideEnabled":false}
